{
  "application_id": "DEMO-CLEAN-001",
  "pipeline_stage": "S7_TYPED_FACTS",
  "simulated": true,
  "decision_support_only": true,
  "canonical_institute": {
    "aicte_id": "1-10998877",
    "name": "Apex Institute of Technology Private Limited",
    "source": "synthetic_record",
    "address": "Plot 42, Knowledge Park III, Greater Noida",
    "state": "Uttar Pradesh",
    "simulated": true
  },
  "aliases": [
    {
      "document_id": "doc-fire-001",
      "doc_type": "FIRE_NOC",
      "extracted_name": "Apex Inst of Tech Pvt. Ltd.",
      "canonical_name": "Apex Institute of Technology Private Limited",
      "match_status": "MATCH",
      "core_extracted": "apex institute technology",
      "core_canonical": "apex institute technology",
      "legal_forms_extracted": ["limited", "private"],
      "legal_forms_canonical": ["limited", "private"]
    }
  ],
  "facts": [
    {
      "id": "fact-DEMO-CLEAN-001-APPLICATION-aicte_id",
      "application_id": "DEMO-CLEAN-001",
      "document_id": null,
      "source": "application_form",
      "entity": "APPLICATION",
      "key": "aicte_id",
      "raw": "1-10998877",
      "value_type": "string",
      "value": "1-10998877",
      "parse_state": "ok",
      "conf": 1.0,
      "conf_kind": "human",
      "grounded": false,
      "source_ref": null,
      "page": null,
      "bbox_norm": null,
      "bbox_precision": null,
      "extractor": "form_submission",
      "extractor_version": "1.0.0",
      "needs_confirmation": false,
      "simulated": true
    },
    {
      "id": "fact-DEMO-CLEAN-001-INSTITUTION-canonical_name",
      "application_id": "DEMO-CLEAN-001",
      "document_id": null,
      "source": "synthetic_record",
      "entity": "INSTITUTION",
      "key": "canonical_name",
      "raw": "Apex Institute of Technology Private Limited",
      "value_type": "string",
      "value": "Apex Institute of Technology Private Limited",
      "parse_state": "ok",
      "conf": 1.0,
      "conf_kind": "regex_exact",
      "grounded": false,
      "source_ref": null,
      "page": null,
      "bbox_norm": null,
      "bbox_precision": null,
      "extractor": "records_adapter",
      "extractor_version": "1.0.0",
      "needs_confirmation": false,
      "simulated": true
    },
    {
      "id": "fact-DEMO-CLEAN-001-APPROVED_PROGRAMMES-approved_intake",
      "application_id": "DEMO-CLEAN-001",
      "document_id": null,
      "source": "synthetic_record",
      "entity": "APPROVED_PROGRAMMES",
      "key": "approved_intake",
      "raw": "480",
      "value_type": "number",
      "value": 480,
      "parse_state": "ok",
      "conf": 1.0,
      "conf_kind": "regex_exact",
      "grounded": false,
      "source_ref": null,
      "page": null,
      "bbox_norm": null,
      "bbox_precision": null,
      "extractor": "records_adapter",
      "extractor_version": "1.0.0",
      "needs_confirmation": false,
      "simulated": true
    }
  ],
  "facts_count": 3
}
